{
  "$schema": "https://raw.githubusercontent.com/Naptie/openmetro/main/schemas/v1/segments.schema.json",
  "schema_version": "1.0",
  "network_id": "cn-guiyang",
  "generated_at": "2026-10-23T12:52:49.106Z",
  "source": [],
  "records": [
    {
      "id": "cn-guiyang-seg-cn-guiyang-bageyan-1-cn-guiyang-beijing-road-1",
      "line_id": "cn-guiyang-line-1",
      "from_stop_id": "cn-guiyang-bageyan-1",
      "to_stop_id": "cn-guiyang-beijing-road-1",
      "from_station_id": "cn-guiyang-bageyan",
      "to_station_id": "cn-guiyang-beijing-road",
      "direction": "both",
      "source_id": "gyurt-planner",
      "travel_time_seconds": 120,
      "travel_time_source": "source",
      "distance_km": 0.571,
      "extras": {
        "distance_source": "gyurt-planner",
        "time_source": "gyurt-planner"
      }
    },
    {
      "id": "cn-guiyang-seg-cn-guiyang-baihua-avenue-2-cn-guiyang-mawangmiao-2",
      "line_id": "cn-guiyang-line-2",
      "from_stop_id": "cn-guiyang-baihua-avenue-2",
      "to_stop_id": "cn-guiyang-mawangmiao-2",
      "from_station_id": "cn-guiyang-baihua-avenue",
      "to_station_id": "cn-guiyang-mawangmiao",
      "direction": "both",
      "source_id": "gyurt-planner",
      "travel_time_seconds": 180,
      "travel_time_source": "source",
      "distance_km": 1.647,
      "extras": {
        "distance_source": "gyurt-planner",
        "time_source": "gyurt-planner"
      }
    },
    {
      "id": "cn-guiyang-seg-cn-guiyang-bailu-lake-1-cn-guiyang-guiyangbei-railway-station-1",
      "line_id": "cn-guiyang-line-1",
      "from_stop_id": "cn-guiyang-bailu-lake-1",
      "to_stop_id": "cn-guiyang-guiyangbei-railway-station-1",
      "from_station_id": "cn-guiyang-bailu-lake",
      "to_station_id": "cn-guiyang-guiyangbei-railway-station",
      "direction": "both",
      "source_id": "gyurt-planner",
      "travel_time_seconds": 180,
      "travel_time_source": "source",
      "distance_km": 1.358,
      "extras": {
        "distance_source": "gyurt-planner",
        "time_source": "gyurt-planner"
      }
    },
    {
      "id": "cn-guiyang-seg-cn-guiyang-beijing-road-1-cn-guiyang-penshuichi-1",
      "line_id": "cn-guiyang-line-1",
      "from_stop_id": "cn-guiyang-beijing-road-1",
      "to_stop_id": "cn-guiyang-penshuichi-1",
      "from_station_id": "cn-guiyang-beijing-road",
      "to_station_id": "cn-guiyang-penshuichi",
      "direction": "both",
      "source_id": "gyurt-planner",
      "travel_time_seconds": 120,
      "travel_time_source": "source",
      "distance_km": 0.949,
      "extras": {
        "distance_source": "gyurt-planner",
        "time_source": "gyurt-planner"
      }
    },
    {
      "id": "cn-guiyang-seg-cn-guiyang-beijing-road-3-cn-guiyang-qianlingshan-park-3",
      "line_id": "cn-guiyang-line-3",
      "from_stop_id": "cn-guiyang-beijing-road-3",
      "to_stop_id": "cn-guiyang-qianlingshan-park-3",
      "from_station_id": "cn-guiyang-beijing-road",
      "to_station_id": "cn-guiyang-qianlingshan-park",
      "direction": "both",
      "source_id": "gyurt-planner",
      "travel_time_seconds": 120,
      "travel_time_source": "source",
      "distance_km": 1.201,
      "extras": {
        "distance_source": "gyurt-planner",
        "time_source": "gyurt-planner"
      }
    },
    {
      "id": "cn-guiyang-seg-cn-guiyang-chadian-3-cn-guiyang-dayingpo-3",
      "line_id": "cn-guiyang-line-3",
      "from_stop_id": "cn-guiyang-chadian-3",
      "to_stop_id": "cn-guiyang-dayingpo-3",
      "from_station_id": "cn-guiyang-chadian",
      "to_station_id": "cn-guiyang-dayingpo",
      "direction": "both",
      "source_id": "gyurt-planner",
      "travel_time_seconds": 120,
      "travel_time_source": "source",
      "distance_km": 1.452,
      "extras": {
        "distance_source": "gyurt-planner",
        "time_source": "gyurt-planner"
      }
    },
    {
      "id": "cn-guiyang-seg-cn-guiyang-changjiang-road-1-cn-guiyang-qingshuijiang-road-1",
      "line_id": "cn-guiyang-line-1",
      "from_stop_id": "cn-guiyang-changjiang-road-1",
      "to_stop_id": "cn-guiyang-qingshuijiang-road-1",
      "from_station_id": "cn-guiyang-changjiang-road",
      "to_station_id": "cn-guiyang-qingshuijiang-road",
      "direction": "both",
      "source_id": "gyurt-planner",
      "travel_time_seconds": 120,
      "travel_time_source": "source",
      "distance_km": 1.238,
      "extras": {
        "distance_source": "gyurt-planner",
        "time_source": "gyurt-planner"
      }
    },
    {
      "id": "cn-guiyang-seg-cn-guiyang-chayuan-2-cn-guiyang-baihua-avenue-2",
      "line_id": "cn-guiyang-line-2",
      "from_stop_id": "cn-guiyang-chayuan-2",
      "to_stop_id": "cn-guiyang-baihua-avenue-2",
      "from_station_id": "cn-guiyang-chayuan",
      "to_station_id": "cn-guiyang-baihua-avenue",
      "direction": "both",
      "source_id": "gyurt-planner",
      "travel_time_seconds": 120,
      "travel_time_source": "source",
      "distance_km": 1.514,
      "extras": {
        "distance_source": "gyurt-planner",
        "time_source": "gyurt-planner"
      }
    },
    {
      "id": "cn-guiyang-seg-cn-guiyang-chengxin-road-2-cn-guiyang-west-lincheng-road-2",
      "line_id": "cn-guiyang-line-2",
      "from_stop_id": "cn-guiyang-chengxin-road-2",
      "to_stop_id": "cn-guiyang-west-lincheng-road-2",
      "from_station_id": "cn-guiyang-chengxin-road",
      "to_station_id": "cn-guiyang-west-lincheng-road",
      "direction": "both",
      "source_id": "gyurt-planner",
      "travel_time_seconds": 120,
      "travel_time_source": "source",
      "distance_km": 0.632,
      "extras": {
        "distance_source": "gyurt-planner",
        "time_source": "gyurt-planner"
      }
    },
    {
      "id": "cn-guiyang-seg-cn-guiyang-dakecheng-S1-cn-guiyang-shugu-avenue-S1",
      "line_id": "cn-guiyang-line-s1",
      "from_stop_id": "cn-guiyang-dakecheng-S1",
      "to_stop_id": "cn-guiyang-shugu-avenue-S1",
      "from_station_id": "cn-guiyang-dakecheng",
      "to_station_id": "cn-guiyang-shugu-avenue",
      "direction": "both",
      "source_id": "gyurt-planner",
      "travel_time_seconds": 120,
      "travel_time_source": "source",
      "distance_km": 0.925,
      "extras": {
        "distance_source": "gyurt-planner",
        "time_source": "gyurt-planner"
      }
    },
    {
      "id": "cn-guiyang-seg-cn-guiyang-dalongjing-S1-cn-guiyang-tianhetan-S1",
      "line_id": "cn-guiyang-line-s1",
      "from_stop_id": "cn-guiyang-dalongjing-S1",
      "to_stop_id": "cn-guiyang-tianhetan-S1",
      "from_station_id": "cn-guiyang-dalongjing",
      "to_station_id": "cn-guiyang-tianhetan",
      "direction": "both",
      "source_id": "gyurt-planner",
      "travel_time_seconds": 300,
      "travel_time_source": "source",
      "distance_km": 3.896,
      "extras": {
        "distance_source": "gyurt-planner",
        "time_source": "gyurt-planner"
      }
    },
    {
      "id": "cn-guiyang-seg-cn-guiyang-dayingpo-3-cn-guiyang-guizhou-medical-university-3",
      "line_id": "cn-guiyang-line-3",
      "from_stop_id": "cn-guiyang-dayingpo-3",
      "to_stop_id": "cn-guiyang-guizhou-medical-university-3",
      "from_station_id": "cn-guiyang-dayingpo",
      "to_station_id": "cn-guiyang-guizhou-medical-university",
      "direction": "both",
      "source_id": "gyurt-planner",
      "travel_time_seconds": 180,
      "travel_time_source": "source",
      "distance_km": 1.678,
      "extras": {
        "distance_source": "gyurt-planner",
        "time_source": "gyurt-planner"
      }
    },
    {
      "id": "cn-guiyang-seg-cn-guiyang-dongfeng-guiqian-hospital-3-cn-guiyang-guizhou-normal-university-3",
      "line_id": "cn-guiyang-line-3",
      "from_stop_id": "cn-guiyang-dongfeng-guiqian-hospital-3",
      "to_stop_id": "cn-guiyang-guizhou-normal-university-3",
      "from_station_id": "cn-guiyang-dongfeng-guiqian-hospital",
      "to_station_id": "cn-guiyang-guizhou-normal-university",
      "direction": "both",
      "source_id": "gyurt-planner",
      "travel_time_seconds": 180,
      "travel_time_source": "source",
      "distance_km": 2.447,
      "extras": {
        "distance_source": "gyurt-planner",
        "time_source": "gyurt-planner"
      }
    },
    {
      "id": "cn-guiyang-seg-cn-guiyang-douguan-1-cn-guiyang-xiamaixi-1",
      "line_id": "cn-guiyang-line-1",
      "from_stop_id": "cn-guiyang-douguan-1",
      "to_stop_id": "cn-guiyang-xiamaixi-1",
      "from_station_id": "cn-guiyang-douguan",
      "to_station_id": "cn-guiyang-xiamaixi",
      "direction": "both",
      "source_id": "gyurt-planner",
      "travel_time_seconds": 120,
      "travel_time_source": "source",
      "distance_km": 1.071,
      "extras": {
        "distance_source": "gyurt-planner",
        "time_source": "gyurt-planner"
      }
    },
    {
      "id": "cn-guiyang-seg-cn-guiyang-fenglin-road-2-cn-guiyang-chengxin-road-2",
      "line_id": "cn-guiyang-line-2",
      "from_stop_id": "cn-guiyang-fenglin-road-2",
      "to_stop_id": "cn-guiyang-chengxin-road-2",
      "from_station_id": "cn-guiyang-fenglin-road",
      "to_station_id": "cn-guiyang-chengxin-road",
      "direction": "both",
      "source_id": "gyurt-planner",
      "travel_time_seconds": 120,
      "travel_time_source": "source",
      "distance_km": 1.181,
      "extras": {
        "distance_source": "gyurt-planner",
        "time_source": "gyurt-planner"
      }
    },
    {
      "id": "cn-guiyang-seg-cn-guiyang-forest-park-2-cn-guiyang-jianlongdong-2",
      "line_id": "cn-guiyang-line-2",
      "from_stop_id": "cn-guiyang-forest-park-2",
      "to_stop_id": "cn-guiyang-jianlongdong-2",
      "from_station_id": "cn-guiyang-forest-park",
      "to_station_id": "cn-guiyang-jianlongdong",
      "direction": "both",
      "source_id": "gyurt-planner",
      "travel_time_seconds": 120,
      "travel_time_source": "source",
      "distance_km": 1.089,
      "extras": {